assessment_id,use_case_id,risk_domain,risk_question,response,risk_level,mitigation_required,mitigation_action,owner,status
ARA001,AI001,Accuracy,Could the AI output be inaccurate or misleading?,Yes,Medium,Yes,Human review before action,Operations Manager,Open
ARA002,AI001,Privacy,Does the use case involve personal or sensitive information?,No,Low,No,None,Privacy Lead,Closed
ARA003,AI001,Human Oversight,Is human review required before action?,Yes,Medium,Yes,Make review mandatory in workflow,Operations Manager,Open
ARA004,AI002,Traceability,Can generated commentary be traced to source data?,Partially,Medium,Yes,Require source references in output,BI Manager,Open
ARA005,AI004,Privacy,Does the use case involve personal or sensitive information?,Yes,High,Yes,Complete privacy review and de-identification plan,Privacy Lead,Open
ARA006,AI004,Vendor Risk,Will an external vendor process organizational data?,Yes,High,Yes,Complete vendor security and data-use review,Procurement Lead,Open
